话题,排名,时刻,话题分类
神十六航天员领命出征,0,2023-05-30 08-39,mainland China politics
中国人筑起攀向太空的天梯,1,2023-05-30 08-39,mainland China politics
官方通报男子砍杀柯基威胁妻子,2,2023-05-30 08-39,International news
YammerS确认已离世,3,2023-05-30 08-39,culture
教育局回应小学不让打伞进校,4,2023-05-30 08-39,mainland China politics
王源一家人各火各的,5,2023-05-30 08-39,entertainment
官方回应怀孕4个月女子遭家暴,6,2023-05-30 08-39,mainland China politics
神十六出征仪式,7,2023-05-30 08-39,mainland China politics
你管周也这张脸叫普普通通,8,2023-05-30 08-39,culture
曝昆汀花1万美元在夜店舔美女的脚,9,2023-05-30 08-39,entertainment
考研进清华和高考进清华的区别,10,2023-05-30 08-39,mainland China politics
小县城十八万八的彩礼合理吗,11,2023-05-30 08-39,mainland China politics
网友点评赵露思虞书欣是韩式演技,12,2023-05-30 08-39,entertainment
刘浩存在海底捞给路人唱生日歌,13,2023-05-30 08-39,entertainment
韩亚航空事件中空姐一直用身体挡住舱门,14,2023-05-30 08-39,International news
福建农业职业技术学院坠楼,15,2023-05-30 08-39,mainland China politics
