话题,排名,时刻,话题分类
恋踩癖男子藏袋内呼吸起伏明显,0,2023-05-25 21-01,International news
上海迪士尼6月23日起门票调价,1,2023-05-25 21-01,financial news
现在进入神舟十六号时间,2,2023-05-25 21-01,mainland China politics
租客仅剩13元花11元买瓜探望房东,3,2023-05-25 21-01,financial news
校内撞死小学生教师或涉两个罪名,4,2023-05-25 21-01,mainland China politics
原来睡着后的世界是这样的,5,2023-05-25 21-01,culture
宁艺卓红毯摔倒,6,2023-05-25 21-01,entertainment
海蝶音乐回应许嵩相关传闻,7,2023-05-25 21-01,entertainment
冯小刚女儿撞脸小S二女儿,8,2023-05-25 21-01,entertainment
第一次见到女爱豆提到卫生巾,9,2023-05-25 21-01,entertainment
吴宣仪2021年收入,10,2023-05-25 21-01,financial news
女孩剪了一撮头发家长赔了1万多,11,2023-05-25 21-01,mainland China politics
国泰航空曾被曝员工拒绝使用中文名名牌,12,2023-05-25 21-01,financial news
艺人化妆师还是个高危职业,13,2023-05-25 21-01,entertainment
三分野直播,14,2023-05-25 21-01,entertainment
