话题,排名,时刻,话题分类
上海迪士尼6月23日起门票调价,0,2023-05-25 21-12,financial news
租客仅剩13元花11元买瓜探望房东,1,2023-05-25 21-12,financial news
现在进入神舟十六号时间,2,2023-05-25 21-12,mainland China politics
恋踩癖男子藏袋内呼吸起伏明显,3,2023-05-25 21-12,International news
校内撞死小学生教师或涉两个罪名,4,2023-05-25 21-12,mainland China politics
原来睡着后的世界是这样的,5,2023-05-25 21-12,culture
奥迪工程车,6,2023-05-25 21-12,financial news
宁艺卓红毯摔倒,7,2023-05-25 21-12,entertainment
海蝶音乐回应许嵩相关传闻,8,2023-05-25 21-12,entertainment
冯小刚女儿撞脸小S二女儿,9,2023-05-25 21-12,entertainment
第一次见到女爱豆提到卫生巾,10,2023-05-25 21-12,entertainment
吴宣仪2021年收入,11,2023-05-25 21-12,financial news
视障女孩摸着盲文朗诵黄河颂,12,2023-05-25 21-12,culture
女孩剪了一撮头发家长赔了1万多,13,2023-05-25 21-12,mainland China politics
樊振东王楚钦男双晋级四强,14,2023-05-25 21-12,sports
宁波一医院突发火灾,15,2023-05-25 21-12,mainland China politics
国泰航空曾被曝员工拒绝使用中文名名牌,16,2023-05-25 21-12,financial news
